{
  "$schema": "https://raw.githubusercontent.com/dkharlanau/agent-ready-web-profile/main/schema/growth-owner-data.schema.json",
  "version": "0.1",
  "site": "https://example.com/",
  "evidenceClass": "owner-data",
  "generatedAt": "2026-09-06T10:00:00Z",
  "guardrails": {
    "notIndependentEvidence": true,
    "noRankingClaim": true,
    "noCrossSurfaceInference": true,
    "noProviderInference": true,
    "sensitiveDataOmitted": true
  },
  "records": [
    {
      "actionId": "observation:google-search-console-baseline",
      "evidenceType": "measurement",
      "provider": "google-search-console",
      "kind": "search-performance",
      "status": "observed",
      "observedAt": "2026-09-06T09:40:05Z",
      "dataThrough": "2026-09-04",
      "summary": "Authenticated standard Search Analytics and URL Inspection ran; no generative-AI performance is asserted.",
      "scope": ["https://example.com/"],
      "evidence": ["https://github.com/example/site/actions/workflows/google-search.yml"],
      "sourceDigest": "sha256:aaaaaaaaaaaaaaaaaaaaaaaaaaaaaaaaaaaaaaaaaaaaaaaaaaaaaaaaaaaaaaaa"
    }
  ]
}
